{
  "$schema": "../../../../schemas/wave-publication-public-safe-evidence.schema.json",
  "record_control": {
    "revision": 1,
    "record_status": "constructed",
    "constructor": {
      "actor_id": "codex-task:019fe093-6890-7d20-9685-e291642d23ef",
      "role": "constructor",
      "constructed_at": "2026-08-09T03:33:36Z"
    },
    "review": null
  },
  "evidence_type": "WAVE_PUBLICATION_PUBLIC_SAFE_EVIDENCE",
  "observation_id": "6529NM-WAVE-PUB-OBS-2026-08-09-001",
  "observed_at": "2026-08-09T02:04:21.7672652Z",
  "source_command": "punk6529bot drops get 002bfa4f-8416-48bf-b35e-38f354e9a9f0 --json",
  "canonicalization": "Hash the payload object only as UTF-8 JSON with recursively lexicographically sorted object keys, source-order arrays, compact separators, preserved Unicode, and no trailing newline.",
  "payload": {
    "drop_id": "002bfa4f-8416-48bf-b35e-38f354e9a9f0",
    "drop_serial_no": 1276093,
    "drop_type": "WINNER",
    "is_signed": true,
    "observed_at": "2026-08-09T02:04:21.7672652Z",
    "parts": [
      {
        "part_id": 1,
        "media": [
          {
            "url": "https://d3lqz0a4bldqgf.cloudfront.net/drops/author_7ee51a67-07b7-4c91-87ed-464c56446c43/f8006332-4f8a-4556-b0df-3c43eec16334/conflict-at-its-edges-cover.png",
            "mime_type": "image/png",
            "media_status": "ready"
          }
        ]
      },
      {
        "part_id": 2,
        "media": [
          {
            "url": "https://d3lqz0a4bldqgf.cloudfront.net/drops/author_7ee51a67-07b7-4c91-87ed-464c56446c43/d498d837-3331-4650-a30e-27ca18d53521/magnum-75-127.jpg",
            "mime_type": "image/jpeg",
            "media_status": "ready"
          }
        ]
      },
      {
        "part_id": 3,
        "media": [
          {
            "url": "https://d3lqz0a4bldqgf.cloudfront.net/drops/author_7ee51a67-07b7-4c91-87ed-464c56446c43/3e2fbdea-cf3c-4949-b3d2-f081cb12de00/magnum-75-145.jpg",
            "mime_type": "image/jpeg",
            "media_status": "ready"
          }
        ]
      },
      {
        "part_id": 4,
        "media": [
          {
            "url": "https://d3lqz0a4bldqgf.cloudfront.net/drops/author_7ee51a67-07b7-4c91-87ed-464c56446c43/2146f5f7-9352-47e6-bf60-cba46e52c07f/magnum-75-97.jpg",
            "mime_type": "image/jpeg",
            "media_status": "ready"
          }
        ]
      },
      {
        "part_id": 5,
        "media": [
          {
            "url": "https://d3lqz0a4bldqgf.cloudfront.net/drops/author_7ee51a67-07b7-4c91-87ed-464c56446c43/5d6d9bf0-7ff3-4afd-ac69-c6b34079fbf9/magnum-75-44.jpg",
            "mime_type": "image/jpeg",
            "media_status": "ready"
          }
        ]
      },
      {
        "part_id": 6,
        "media": [
          {
            "url": "https://d3lqz0a4bldqgf.cloudfront.net/drops/author_7ee51a67-07b7-4c91-87ed-464c56446c43/4526b19e-76df-493b-86ac-105782c061ea/magnum-75-104.jpg",
            "mime_type": "image/jpeg",
            "media_status": "ready"
          }
        ]
      },
      {
        "part_id": 7,
        "media": []
      }
    ],
    "wave_id": "5f207393-5418-4a75-8738-e40edb44a94d",
    "wave_name": "6529 Network Museum"
  },
  "payload_sha256": "sha256:93e968562297fe5acff792e027f302b938ba6fa1ac88284754c4ba684d1266a2",
  "exclusion_note": "Public-safe projection of the live drop read. The retained record excludes author/profile fields, rater/profile/reaction data, addresses, credentials, and all non-media drop fields. WINNER and signed state record a Wave decision/publication observation only; they do not establish donor authority, legal title, copyright, custody, acceptance, accession, Collection status, or display permission. The media URLs remain non-rendering evidence locators."
}
